{
  "year": 2026,
  "month": 4,
  "language": "ru",
  "days": [
    {"date": "2026-04-04", "description": ["Суббота второй седмицы.", "Вымышленный пример описания дня."], "services": [{"time": "17:00", "title": "Вечернее богослужение", "hours": "Храм открыт с 16:30", "priest": "Священник: пример"}]},
    {"date": "2026-04-05", "description": ["Вход Господень в Иерусалим."], "services": [{"time": "09:00", "title": "Божественная литургия", "hours": "Храм открыт с 08:30", "priest": "Священник: пример"}]},
    {"date": "2026-04-07", "description": ["Благовещение Пресвятой Богородицы."], "services": [{"time": "10:00", "title": "Праздничная литургия", "hours": "", "priest": ""}]},
    {"date": "2026-04-12", "description": ["Пасха Христова."], "services": [{"time": "00:00", "title": "Пасхальное богослужение", "hours": "", "priest": "Священник: пример"}]}
  ]
}
